date,text,posted
2026-06-25,"利益が出ているはずなのに、お金が残らない。営業現場でよく聞く悩みです。原因をたどると、案件ごとの採算が見えていないケースがあります。売上全体ではなく、どの案件で利益が出ているのかを把握することが、改善の第一歩だと感じます。",no
2026-06-26,"月次決算で利益を確認した時には、すでに手遅れということがあります。経営判断に必要なのは過去の結果だけではなく、進行中案件の着地予測です。今どの案件が危険なのかを早く把握できる仕組みが重要だと感じています。",no
2026-06-27,"Excelは優れたツールですが、案件数や担当者が増えると集計や転記の負担が大きくなります。入力はしているのに活用できていない、という状態は意外と多いものです。データは蓄積するだけでなく、経営判断に使えて初めて価値になります。",no
2026-06-28,"忙しいのに利益が増えない会社には共通点があります。売上や受注状況は見えていても、誰がどの案件にどれだけ時間を使ったかが見えていないケースです。利益改善の第一歩は、売上ではなく時間の使い方を見える化することかもしれません。",no
2026-06-29,"見積時には利益が出るはずだった案件が、終わってみると赤字だった。建設業や受託型ビジネスでは珍しくありません。設計変更、追加対応、手戻りなど、利益を削る要因は日々発生します。だからこそ途中経過の把握が重要です。",no
2026-06-30,"経営者の方と話していると、数字は会計事務所からもらっているという声をよく聞きます。一方で、本当に知りたいのは先月の結果ではなく、今月末や来月末の着地予測ではないでしょうか。未来を見るための数字が経営には必要です。",no
2026-07-01,"DXという言葉をよく聞きますが、システム導入自体が目的になってしまうケースも少なくありません。本当に大切なのは、経営判断が早くなること、現場の負担が減ること、利益改善につながること。その結果としてDXがあるのだと思います。",no
2026-07-02,"現場の人は忙しい。だからこそ、入力してもらう情報はできるだけ少なく、経営に使える形で集める必要があります。報告のための入力では続きません。現場の負担を増やさず、経営判断に必要な情報を集める設計が大切だと感じます。",no
2026-07-03,"社長の頭の中には、この取引先は手間がかかる、この案件は利益が薄い、という感覚があります。ただ、それが数字として残っていないことも多いです。経験や勘は大切ですが、次の判断に活かすには、感覚を見える化することが必要です。",no
2026-07-04,"売上が伸びているのに、なぜか資金繰りが苦しい。そんな会社では、入金予定、支払予定、案件ごとの原価発生タイミングが見えていないことがあります。利益と現金の動きは別物です。経営には、その両方を見える状態が必要だと感じます。",no
